item,value,status,notes
generated_at,2026-06-20 01:03:49,info,Local system timestamp
documents_audited,12,pass,Public-facing manuscript/submission documents scanned
audit_rows,106,pass,Total audit findings including acceptable boundary contexts
needs_revision_rows,0,pass,High-risk unnegated overclaim or missing boundary rows
needs_human_review_rows,0,pass,Medium-risk unnegated terms requiring final reading
machine_claim_boundary_clearance,yes,pass,Machine clearance requires no high-risk unnegated overclaim rows
